{
  "sender": "planner",
  "recipient": "worker",
  "task": {
    "id": "hello-agent",
    "summary": "Send a minimal greeting packet",
    "kind": "demo",
    "priority": "low"
  },
  "call": {
    "tool": "trace.emit",
    "mode": "sync"
  },
  "trace": "hello_trace",
  "commit": {
    "status": "queued"
  }
}
